{
  "constraints": [
    {
      "kind": "dimension",
      "parameters": {
        "parameter": "size",
        "value": [
          110.0,
          20.0,
          60.0
        ]
      },
      "target": "body",
      "tolerance": 1e-06
    }
  ],
  "metadata": {
    "confidence": 0.6,
    "connections": [],
    "contract_prompt": "a 110 x 20 x 60 mm box",
    "corner_radius_explicit": false,
    "corner_radius_mm": null,
    "dimensions_mm": [
      110.0,
      20.0,
      60.0
    ],
    "domain": "container",
    "explicit_dimensions": true,
    "fabrication_domain": "enclosure",
    "flags": {
      "fins": false,
      "holes": false,
      "hollow": false,
      "rounded": false,
      "shaft": false,
      "slots": false,
      "wheels": false,
      "wings": false
    },
    "hole_count_explicit": false,
    "hole_count_requested": 0,
    "hole_diameter_explicit": false,
    "hole_diameter_mm": null,
    "ignored_qualitative_terms": [],
    "interpretation_mode": "strict",
    "normalized_prompt": "a 110 x 20 x 60 mm box",
    "prompt": "a 110 x 20 x 60 mm box",
    "prompt_fully_consumed": true,
    "recognized": true,
    "rounded_requested": false,
    "slot_count_explicit": false,
    "slot_count_requested": 0,
    "slot_dimensions_explicit": false,
    "slot_dimensions_mm": null,
    "source": "natural_language_design_graph",
    "source_kind": "prompt",
    "units": "mm",
    "wall_thickness_explicit": false,
    "wall_thickness_mm": null
  },
  "nodes": [
    {
      "id": "body",
      "primitive": {
        "kind": "box",
        "parameters": {
          "size": [
            110.0,
            20.0,
            60.0
          ]
        }
      },
      "role": "body",
      "transform": {
        "rotate": [
          0.0,
          0.0,
          0.0
        ],
        "scale": [
          1.0,
          1.0,
          1.0
        ],
        "translate": [
          0.0,
          0.0,
          0.0
        ]
      }
    }
  ],
  "roots": [
    "body"
  ],
  "title": "a 110 x 20 x 60 mm box",
  "units": "mm",
  "version": "neurocad-ir-v1"
}
