{
  "constraints": [
    {
      "kind": "dimension",
      "parameters": {
        "parameter": "size",
        "value": [
          190.0,
          110.0,
          3.0
        ]
      },
      "target": "body",
      "tolerance": 1e-06
    },
    {
      "kind": "dimension",
      "parameters": {
        "parameter": "size",
        "value": [
          12.0,
          3.0,
          5.0
        ]
      },
      "target": "slot_1",
      "tolerance": 1e-06
    },
    {
      "kind": "dimension",
      "parameters": {
        "parameter": "size",
        "value": [
          12.0,
          3.0,
          5.0
        ]
      },
      "target": "slot_2",
      "tolerance": 1e-06
    },
    {
      "kind": "dimension",
      "parameters": {
        "parameter": "size",
        "value": [
          12.0,
          3.0,
          5.0
        ]
      },
      "target": "slot_3",
      "tolerance": 1e-06
    },
    {
      "kind": "child_count",
      "parameters": {
        "value": 4
      },
      "target": "design_difference",
      "tolerance": 1e-06
    }
  ],
  "metadata": {
    "confidence": 0.9,
    "connections": [
      {
        "a": "body",
        "b": "slot_1",
        "relation": "cutout"
      },
      {
        "a": "body",
        "b": "slot_2",
        "relation": "cutout"
      },
      {
        "a": "body",
        "b": "slot_3",
        "relation": "cutout"
      }
    ],
    "contract_prompt": "a 190 x 110 x 3 mm plate with three 12 x 3 mm slots",
    "corner_radius_explicit": false,
    "corner_radius_mm": null,
    "dimensions_mm": [
      190.0,
      110.0,
      3.0
    ],
    "domain": "plate",
    "explicit_dimensions": true,
    "fabrication_domain": "plate",
    "flags": {
      "fins": false,
      "holes": false,
      "hollow": false,
      "rounded": false,
      "shaft": false,
      "slots": true,
      "wheels": false,
      "wings": false
    },
    "hole_count_explicit": false,
    "hole_count_requested": 0,
    "hole_diameter_explicit": false,
    "hole_diameter_mm": null,
    "ignored_qualitative_terms": [],
    "interpretation_mode": "strict",
    "normalized_prompt": "a 190 x 110 x 3 mm plate with three 12 x 3 mm slots",
    "prompt": "a 190 x 110 x 3 mm plate with three 12 x 3 mm slots",
    "prompt_fully_consumed": true,
    "recognized": true,
    "rounded_requested": false,
    "slot_count_explicit": true,
    "slot_count_requested": 3,
    "slot_dimensions_explicit": true,
    "slot_dimensions_mm": [
      12.0,
      3.0
    ],
    "source": "natural_language_design_graph",
    "source_kind": "prompt",
    "units": "mm",
    "wall_thickness_explicit": false,
    "wall_thickness_mm": null
  },
  "nodes": [
    {
      "id": "body",
      "primitive": {
        "kind": "box",
        "parameters": {
          "size": [
            190.0,
            110.0,
            3.0
          ]
        }
      },
      "role": "body",
      "transform": {
        "rotate": [
          0.0,
          0.0,
          0.0
        ],
        "scale": [
          1.0,
          1.0,
          1.0
        ],
        "translate": [
          0.0,
          0.0,
          0.0
        ]
      }
    },
    {
      "id": "slot_1",
      "primitive": {
        "kind": "box",
        "parameters": {
          "size": [
            12.0,
            3.0,
            5.0
          ]
        }
      },
      "role": "feature",
      "transform": {
        "rotate": [
          0.0,
          0.0,
          0.0
        ],
        "scale": [
          1.0,
          1.0,
          1.0
        ],
        "translate": [
          83.0,
          0.0,
          0.0
        ]
      }
    },
    {
      "id": "slot_2",
      "primitive": {
        "kind": "box",
        "parameters": {
          "size": [
            12.0,
            3.0,
            5.0
          ]
        }
      },
      "role": "feature",
      "transform": {
        "rotate": [
          0.0,
          0.0,
          0.0
        ],
        "scale": [
          1.0,
          1.0,
          1.0
        ],
        "translate": [
          -41.499999999999986,
          37.239092362730865,
          0.0
        ]
      }
    },
    {
      "id": "slot_3",
      "primitive": {
        "kind": "box",
        "parameters": {
          "size": [
            12.0,
            3.0,
            5.0
          ]
        }
      },
      "role": "feature",
      "transform": {
        "rotate": [
          0.0,
          0.0,
          0.0
        ],
        "scale": [
          1.0,
          1.0,
          1.0
        ],
        "translate": [
          -41.500000000000036,
          -37.23909236273085,
          0.0
        ]
      }
    },
    {
      "children": [
        "body",
        "slot_1",
        "slot_2",
        "slot_3"
      ],
      "composition": "difference",
      "id": "design_difference",
      "role": "composition",
      "transform": {
        "rotate": [
          0.0,
          0.0,
          0.0
        ],
        "scale": [
          1.0,
          1.0,
          1.0
        ],
        "translate": [
          0.0,
          0.0,
          0.0
        ]
      }
    }
  ],
  "roots": [
    "design_difference"
  ],
  "title": "a 190 x 110 x 3 mm plate with three 12 x 3 mm slots",
  "units": "mm",
  "version": "neurocad-ir-v1"
}
