{
  "constraints": [
    {
      "kind": "dimension",
      "parameters": {
        "parameter": "size",
        "value": [
          100.0,
          100.0,
          90.0
        ]
      },
      "target": "body",
      "tolerance": 1e-06
    },
    {
      "kind": "dimension",
      "parameters": {
        "parameter": "size",
        "value": [
          95.0,
          95.0,
          87.7
        ]
      },
      "target": "cavity",
      "tolerance": 1e-06
    },
    {
      "kind": "child_count",
      "parameters": {
        "value": 2
      },
      "target": "design_difference",
      "tolerance": 1e-06
    }
  ],
  "metadata": {
    "confidence": 0.9,
    "connections": [
      {
        "a": "body",
        "b": "cavity",
        "relation": "shell"
      }
    ],
    "dimensions_mm": [
      100.0,
      100.0,
      90.0
    ],
    "domain": "container",
    "explicit_dimensions": true,
    "fabrication_domain": "enclosure",
    "flags": {
      "fins": false,
      "holes": false,
      "hollow": false,
      "rounded": false,
      "shaft": false,
      "slots": false,
      "wheels": false,
      "wings": false
    },
    "hole_count_requested": 0,
    "hole_diameter_explicit": false,
    "hole_diameter_mm": null,
    "normalized_prompt": "a 100 x 100 x 90 mm enclosure with 2.5 mm wall thickness",
    "prompt": "a 100 x 100 x 90 mm enclosure with 2.5 mm wall thickness",
    "recognized": true,
    "slot_count_requested": 0,
    "slot_dimensions_explicit": false,
    "source": "natural_language_design_graph",
    "units": "mm",
    "wall_thickness_explicit": true,
    "wall_thickness_mm": 2.5
  },
  "nodes": [
    {
      "id": "body",
      "primitive": {
        "kind": "box",
        "parameters": {
          "size": [
            100.0,
            100.0,
            90.0
          ]
        }
      },
      "role": "body",
      "transform": {
        "rotate": [
          0.0,
          0.0,
          0.0
        ],
        "scale": [
          1.0,
          1.0,
          1.0
        ],
        "translate": [
          0.0,
          0.0,
          0.0
        ]
      }
    },
    {
      "id": "cavity",
      "primitive": {
        "kind": "box",
        "parameters": {
          "size": [
            95.0,
            95.0,
            87.7
          ]
        }
      },
      "role": "feature",
      "transform": {
        "rotate": [
          0.0,
          0.0,
          0.0
        ],
        "scale": [
          1.0,
          1.0,
          1.0
        ],
        "translate": [
          0.0,
          0.0,
          1.35
        ]
      }
    },
    {
      "children": [
        "body",
        "cavity"
      ],
      "composition": "difference",
      "id": "design_difference",
      "role": "composition",
      "transform": {
        "rotate": [
          0.0,
          0.0,
          0.0
        ],
        "scale": [
          1.0,
          1.0,
          1.0
        ],
        "translate": [
          0.0,
          0.0,
          0.0
        ]
      }
    }
  ],
  "roots": [
    "design_difference"
  ],
  "title": "a 100 x 100 x 90 mm enclosure with 2.5 mm wall thickness",
  "units": "mm",
  "version": "neurocad-ir-v1"
}
