{
  "constraints": [
    {
      "kind": "dimension",
      "parameters": {
        "parameter": "size",
        "value": [
          180.0,
          90.0,
          5.0
        ]
      },
      "target": "body",
      "tolerance": 1e-06
    },
    {
      "kind": "dimension",
      "parameters": {
        "parameter": "radius",
        "value": 2.5
      },
      "target": "hole_1",
      "tolerance": 1e-06
    },
    {
      "kind": "dimension",
      "parameters": {
        "parameter": "height",
        "value": 7.0
      },
      "target": "hole_1",
      "tolerance": 1e-06
    },
    {
      "kind": "dimension",
      "parameters": {
        "parameter": "radius",
        "value": 2.5
      },
      "target": "hole_2",
      "tolerance": 1e-06
    },
    {
      "kind": "dimension",
      "parameters": {
        "parameter": "height",
        "value": 7.0
      },
      "target": "hole_2",
      "tolerance": 1e-06
    },
    {
      "kind": "dimension",
      "parameters": {
        "parameter": "radius",
        "value": 2.5
      },
      "target": "hole_3",
      "tolerance": 1e-06
    },
    {
      "kind": "dimension",
      "parameters": {
        "parameter": "height",
        "value": 7.0
      },
      "target": "hole_3",
      "tolerance": 1e-06
    },
    {
      "kind": "dimension",
      "parameters": {
        "parameter": "radius",
        "value": 2.5
      },
      "target": "hole_4",
      "tolerance": 1e-06
    },
    {
      "kind": "dimension",
      "parameters": {
        "parameter": "height",
        "value": 7.0
      },
      "target": "hole_4",
      "tolerance": 1e-06
    },
    {
      "kind": "child_count",
      "parameters": {
        "value": 5
      },
      "target": "design_difference",
      "tolerance": 1e-06
    }
  ],
  "metadata": {
    "confidence": 0.9,
    "connections": [
      {
        "a": "body",
        "b": "hole_1",
        "relation": "cutout"
      },
      {
        "a": "body",
        "b": "hole_2",
        "relation": "cutout"
      },
      {
        "a": "body",
        "b": "hole_3",
        "relation": "cutout"
      },
      {
        "a": "body",
        "b": "hole_4",
        "relation": "cutout"
      }
    ],
    "contract_prompt": "a 18 x 9 x 0.5 cm plate with four 0.5 cm holes",
    "corner_radius_explicit": false,
    "corner_radius_mm": null,
    "dimensions_mm": [
      180.0,
      90.0,
      5.0
    ],
    "domain": "plate",
    "explicit_dimensions": true,
    "fabrication_domain": "plate",
    "flags": {
      "fins": false,
      "holes": true,
      "hollow": false,
      "rounded": false,
      "shaft": false,
      "slots": false,
      "wheels": false,
      "wings": false
    },
    "hole_count_explicit": true,
    "hole_count_requested": 4,
    "hole_diameter_explicit": true,
    "hole_diameter_mm": 5.0,
    "ignored_qualitative_terms": [],
    "interpretation_mode": "strict",
    "normalized_prompt": "a 18 x 9 x 0.5 cm plate with four 0.5 cm holes",
    "prompt": "a 18 x 9 x 0.5 cm plate with four 0.5 cm holes",
    "prompt_fully_consumed": true,
    "recognized": true,
    "rounded_requested": false,
    "slot_count_explicit": false,
    "slot_count_requested": 0,
    "slot_dimensions_explicit": false,
    "slot_dimensions_mm": null,
    "source": "natural_language_design_graph",
    "source_kind": "prompt",
    "units": "mm",
    "wall_thickness_explicit": false,
    "wall_thickness_mm": null
  },
  "nodes": [
    {
      "id": "body",
      "primitive": {
        "kind": "box",
        "parameters": {
          "size": [
            180.0,
            90.0,
            5.0
          ]
        }
      },
      "role": "body",
      "transform": {
        "rotate": [
          0.0,
          0.0,
          0.0
        ],
        "scale": [
          1.0,
          1.0,
          1.0
        ],
        "translate": [
          0.0,
          0.0,
          0.0
        ]
      }
    },
    {
      "id": "hole_1",
      "primitive": {
        "kind": "cylinder",
        "parameters": {
          "height": 7.0,
          "radius": 2.5
        }
      },
      "role": "fastener",
      "transform": {
        "rotate": [
          0.0,
          0.0,
          0.0
        ],
        "scale": [
          1.0,
          1.0,
          1.0
        ],
        "translate": [
          -81.0,
          -36.0,
          0.0
        ]
      }
    },
    {
      "id": "hole_2",
      "primitive": {
        "kind": "cylinder",
        "parameters": {
          "height": 7.0,
          "radius": 2.5
        }
      },
      "role": "fastener",
      "transform": {
        "rotate": [
          0.0,
          0.0,
          0.0
        ],
        "scale": [
          1.0,
          1.0,
          1.0
        ],
        "translate": [
          -81.0,
          36.0,
          0.0
        ]
      }
    },
    {
      "id": "hole_3",
      "primitive": {
        "kind": "cylinder",
        "parameters": {
          "height": 7.0,
          "radius": 2.5
        }
      },
      "role": "fastener",
      "transform": {
        "rotate": [
          0.0,
          0.0,
          0.0
        ],
        "scale": [
          1.0,
          1.0,
          1.0
        ],
        "translate": [
          81.0,
          -36.0,
          0.0
        ]
      }
    },
    {
      "id": "hole_4",
      "primitive": {
        "kind": "cylinder",
        "parameters": {
          "height": 7.0,
          "radius": 2.5
        }
      },
      "role": "fastener",
      "transform": {
        "rotate": [
          0.0,
          0.0,
          0.0
        ],
        "scale": [
          1.0,
          1.0,
          1.0
        ],
        "translate": [
          81.0,
          36.0,
          0.0
        ]
      }
    },
    {
      "children": [
        "body",
        "hole_1",
        "hole_2",
        "hole_3",
        "hole_4"
      ],
      "composition": "difference",
      "id": "design_difference",
      "role": "composition",
      "transform": {
        "rotate": [
          0.0,
          0.0,
          0.0
        ],
        "scale": [
          1.0,
          1.0,
          1.0
        ],
        "translate": [
          0.0,
          0.0,
          0.0
        ]
      }
    }
  ],
  "roots": [
    "design_difference"
  ],
  "title": "a 18 x 9 x 0.5 cm plate with four 0.5 cm holes",
  "units": "mm",
  "version": "neurocad-ir-v1"
}
