{
  "constraints": [
    {
      "kind": "dimension",
      "parameters": {
        "parameter": "radius",
        "value": 43.0
      },
      "target": "body",
      "tolerance": 1e-06
    },
    {
      "kind": "dimension",
      "parameters": {
        "parameter": "height",
        "value": 85.0
      },
      "target": "body",
      "tolerance": 1e-06
    }
  ],
  "metadata": {
    "confidence": 0.6,
    "connections": [],
    "contract_prompt": "a cylinder with radius 4.3 cm and height 8.5 cm",
    "domain": "generic",
    "explicit_dimensions": true,
    "fabrication_domain": "primitive",
    "flags": {
      "fins": false,
      "holes": false,
      "hollow": false,
      "rounded": false,
      "shaft": false,
      "slots": false,
      "wheels": false,
      "wings": false
    },
    "ignored_qualitative_terms": [],
    "interpretation_mode": "strict",
    "normalized_prompt": "a cylinder with radius 4.3 cm and height 8.5 cm",
    "prompt": "a cylinder with radius 4.3 cm and height 8.5 cm",
    "prompt_fully_consumed": true,
    "recognized": true,
    "source": "natural_language_design_graph",
    "source_kind": "prompt",
    "units": "mm"
  },
  "nodes": [
    {
      "id": "body",
      "primitive": {
        "kind": "cylinder",
        "parameters": {
          "height": 85.0,
          "radius": 43.0
        }
      },
      "role": "body",
      "transform": {
        "rotate": [
          0.0,
          0.0,
          0.0
        ],
        "scale": [
          1.0,
          1.0,
          1.0
        ],
        "translate": [
          0.0,
          0.0,
          0.0
        ]
      }
    }
  ],
  "roots": [
    "body"
  ],
  "title": "a cylinder with radius 4.3 cm and height 8.5 cm",
  "units": "mm",
  "version": "neurocad-ir-v1"
}
