{
  "constraints": [
    {
      "kind": "dimension",
      "parameters": {
        "parameter": "size",
        "value": [
          140.0,
          70.0,
          50.0
        ]
      },
      "target": "body",
      "tolerance": 1e-06
    },
    {
      "kind": "dimension",
      "parameters": {
        "parameter": "size",
        "value": [
          137.0,
          67.0,
          48.7
        ]
      },
      "target": "cavity",
      "tolerance": 1e-06
    },
    {
      "kind": "child_count",
      "parameters": {
        "value": 2
      },
      "target": "design_difference",
      "tolerance": 1e-06
    }
  ],
  "metadata": {
    "confidence": 0.9,
    "connections": [
      {
        "a": "body",
        "b": "cavity",
        "relation": "shell"
      }
    ],
    "contract_prompt": "a 140 x 70 x 50 mm enclosure with 1.5 mm wall thickness",
    "corner_radius_explicit": false,
    "corner_radius_mm": null,
    "dimensions_mm": [
      140.0,
      70.0,
      50.0
    ],
    "domain": "container",
    "explicit_dimensions": true,
    "fabrication_domain": "enclosure",
    "flags": {
      "fins": false,
      "holes": false,
      "hollow": false,
      "rounded": false,
      "shaft": false,
      "slots": false,
      "wheels": false,
      "wings": false
    },
    "hole_count_explicit": false,
    "hole_count_requested": 0,
    "hole_diameter_explicit": false,
    "hole_diameter_mm": null,
    "ignored_qualitative_terms": [],
    "interpretation_mode": "strict",
    "normalized_prompt": "a 140 x 70 x 50 mm enclosure with 1.5 mm wall thickness",
    "prompt": "a 140 x 70 x 50 mm enclosure with 1.5 mm wall thickness",
    "prompt_fully_consumed": true,
    "recognized": true,
    "rounded_requested": false,
    "slot_count_explicit": false,
    "slot_count_requested": 0,
    "slot_dimensions_explicit": false,
    "slot_dimensions_mm": null,
    "source": "natural_language_design_graph",
    "source_kind": "prompt",
    "units": "mm",
    "wall_thickness_explicit": true,
    "wall_thickness_mm": 1.5
  },
  "nodes": [
    {
      "id": "body",
      "primitive": {
        "kind": "box",
        "parameters": {
          "size": [
            140.0,
            70.0,
            50.0
          ]
        }
      },
      "role": "body",
      "transform": {
        "rotate": [
          0.0,
          0.0,
          0.0
        ],
        "scale": [
          1.0,
          1.0,
          1.0
        ],
        "translate": [
          0.0,
          0.0,
          0.0
        ]
      }
    },
    {
      "id": "cavity",
      "primitive": {
        "kind": "box",
        "parameters": {
          "size": [
            137.0,
            67.0,
            48.7
          ]
        }
      },
      "role": "feature",
      "transform": {
        "rotate": [
          0.0,
          0.0,
          0.0
        ],
        "scale": [
          1.0,
          1.0,
          1.0
        ],
        "translate": [
          0.0,
          0.0,
          0.85
        ]
      }
    },
    {
      "children": [
        "body",
        "cavity"
      ],
      "composition": "difference",
      "id": "design_difference",
      "role": "composition",
      "transform": {
        "rotate": [
          0.0,
          0.0,
          0.0
        ],
        "scale": [
          1.0,
          1.0,
          1.0
        ],
        "translate": [
          0.0,
          0.0,
          0.0
        ]
      }
    }
  ],
  "roots": [
    "design_difference"
  ],
  "title": "a 140 x 70 x 50 mm enclosure with 1.5 mm wall thickness",
  "units": "mm",
  "version": "neurocad-ir-v1"
}
