{
  "constraints": [
    {
      "kind": "dimension",
      "parameters": {
        "parameter": "size",
        "value": [
          150.0,
          160.0,
          5.0
        ]
      },
      "target": "body",
      "tolerance": 1e-06
    },
    {
      "kind": "dimension",
      "parameters": {
        "parameter": "size",
        "value": [
          20.0,
          5.0,
          7.0
        ]
      },
      "target": "slot_1",
      "tolerance": 1e-06
    },
    {
      "kind": "dimension",
      "parameters": {
        "parameter": "size",
        "value": [
          20.0,
          5.0,
          7.0
        ]
      },
      "target": "slot_2",
      "tolerance": 1e-06
    },
    {
      "kind": "dimension",
      "parameters": {
        "parameter": "size",
        "value": [
          20.0,
          5.0,
          7.0
        ]
      },
      "target": "slot_3",
      "tolerance": 1e-06
    },
    {
      "kind": "dimension",
      "parameters": {
        "parameter": "size",
        "value": [
          20.0,
          5.0,
          7.0
        ]
      },
      "target": "slot_4",
      "tolerance": 1e-06
    },
    {
      "kind": "child_count",
      "parameters": {
        "value": 5
      },
      "target": "design_difference",
      "tolerance": 1e-06
    }
  ],
  "metadata": {
    "confidence": 0.9,
    "connections": [
      {
        "a": "body",
        "b": "slot_1",
        "relation": "cutout"
      },
      {
        "a": "body",
        "b": "slot_2",
        "relation": "cutout"
      },
      {
        "a": "body",
        "b": "slot_3",
        "relation": "cutout"
      },
      {
        "a": "body",
        "b": "slot_4",
        "relation": "cutout"
      }
    ],
    "dimensions_mm": [
      150.0,
      160.0,
      5.0
    ],
    "domain": "plate",
    "explicit_dimensions": true,
    "fabrication_domain": "plate",
    "flags": {
      "fins": false,
      "holes": false,
      "hollow": false,
      "rounded": false,
      "shaft": false,
      "slots": true,
      "wheels": false,
      "wings": false
    },
    "hole_count_requested": 0,
    "hole_diameter_explicit": false,
    "hole_diameter_mm": null,
    "normalized_prompt": "a 150 x 160 x 5 mm plate with four 20 x 5 mm slots",
    "prompt": "a 150 x 160 x 5 mm plate with four 20 x 5 mm slots",
    "recognized": true,
    "slot_count_requested": 4,
    "slot_dimensions_explicit": true,
    "source": "natural_language_design_graph",
    "units": "mm",
    "wall_thickness_explicit": false,
    "wall_thickness_mm": null
  },
  "nodes": [
    {
      "id": "body",
      "primitive": {
        "kind": "box",
        "parameters": {
          "size": [
            150.0,
            160.0,
            5.0
          ]
        }
      },
      "role": "body",
      "transform": {
        "rotate": [
          0.0,
          0.0,
          0.0
        ],
        "scale": [
          1.0,
          1.0,
          1.0
        ],
        "translate": [
          0.0,
          0.0,
          0.0
        ]
      }
    },
    {
      "id": "slot_1",
      "primitive": {
        "kind": "box",
        "parameters": {
          "size": [
            20.0,
            5.0,
            7.0
          ]
        }
      },
      "role": "feature",
      "transform": {
        "rotate": [
          0.0,
          0.0,
          0.0
        ],
        "scale": [
          1.0,
          1.0,
          1.0
        ],
        "translate": [
          -55.0,
          -60.0,
          0.0
        ]
      }
    },
    {
      "id": "slot_2",
      "primitive": {
        "kind": "box",
        "parameters": {
          "size": [
            20.0,
            5.0,
            7.0
          ]
        }
      },
      "role": "feature",
      "transform": {
        "rotate": [
          0.0,
          0.0,
          0.0
        ],
        "scale": [
          1.0,
          1.0,
          1.0
        ],
        "translate": [
          -55.0,
          60.0,
          0.0
        ]
      }
    },
    {
      "id": "slot_3",
      "primitive": {
        "kind": "box",
        "parameters": {
          "size": [
            20.0,
            5.0,
            7.0
          ]
        }
      },
      "role": "feature",
      "transform": {
        "rotate": [
          0.0,
          0.0,
          0.0
        ],
        "scale": [
          1.0,
          1.0,
          1.0
        ],
        "translate": [
          55.0,
          -60.0,
          0.0
        ]
      }
    },
    {
      "id": "slot_4",
      "primitive": {
        "kind": "box",
        "parameters": {
          "size": [
            20.0,
            5.0,
            7.0
          ]
        }
      },
      "role": "feature",
      "transform": {
        "rotate": [
          0.0,
          0.0,
          0.0
        ],
        "scale": [
          1.0,
          1.0,
          1.0
        ],
        "translate": [
          55.0,
          60.0,
          0.0
        ]
      }
    },
    {
      "children": [
        "body",
        "slot_1",
        "slot_2",
        "slot_3",
        "slot_4"
      ],
      "composition": "difference",
      "id": "design_difference",
      "role": "composition",
      "transform": {
        "rotate": [
          0.0,
          0.0,
          0.0
        ],
        "scale": [
          1.0,
          1.0,
          1.0
        ],
        "translate": [
          0.0,
          0.0,
          0.0
        ]
      }
    }
  ],
  "roots": [
    "design_difference"
  ],
  "title": "a 150 x 160 x 5 mm plate with four 20 x 5 mm slots",
  "units": "mm",
  "version": "neurocad-ir-v1"
}
