{
  "constraints": [
    {
      "kind": "dimension",
      "parameters": {
        "parameter": "size",
        "value": [
          76.19999999999999,
          50.8,
          2.54
        ]
      },
      "target": "body",
      "tolerance": 1e-06
    }
  ],
  "metadata": {
    "confidence": 0.6,
    "connections": [],
    "contract_prompt": "a 3 by 2 by 0.1 inch plate",
    "corner_radius_explicit": false,
    "corner_radius_mm": null,
    "dimensions_mm": [
      76.19999999999999,
      50.8,
      2.54
    ],
    "domain": "plate",
    "explicit_dimensions": true,
    "fabrication_domain": "plate",
    "flags": {
      "fins": false,
      "holes": false,
      "hollow": false,
      "rounded": false,
      "shaft": false,
      "slots": false,
      "wheels": false,
      "wings": false
    },
    "hole_count_explicit": false,
    "hole_count_requested": 0,
    "hole_diameter_explicit": false,
    "hole_diameter_mm": null,
    "ignored_qualitative_terms": [],
    "interpretation_mode": "strict",
    "normalized_prompt": "a 3 by 2 by 0.1 inch plate",
    "prompt": "a 3 by 2 by 0.1 inch plate",
    "prompt_fully_consumed": true,
    "recognized": true,
    "rounded_requested": false,
    "slot_count_explicit": false,
    "slot_count_requested": 0,
    "slot_dimensions_explicit": false,
    "slot_dimensions_mm": null,
    "source": "natural_language_design_graph",
    "source_kind": "prompt",
    "units": "mm",
    "wall_thickness_explicit": false,
    "wall_thickness_mm": null
  },
  "nodes": [
    {
      "id": "body",
      "primitive": {
        "kind": "box",
        "parameters": {
          "size": [
            76.19999999999999,
            50.8,
            2.54
          ]
        }
      },
      "role": "body",
      "transform": {
        "rotate": [
          0.0,
          0.0,
          0.0
        ],
        "scale": [
          1.0,
          1.0,
          1.0
        ],
        "translate": [
          0.0,
          0.0,
          0.0
        ]
      }
    }
  ],
  "roots": [
    "body"
  ],
  "title": "a 3 by 2 by 0.1 inch plate",
  "units": "mm",
  "version": "neurocad-ir-v1"
}
