{
  "constraints": [
    {
      "kind": "dimension",
      "parameters": {
        "parameter": "size",
        "value": [
          55.0,
          95.0,
          4.0
        ]
      },
      "target": "body",
      "tolerance": 1e-06
    }
  ],
  "metadata": {
    "confidence": 0.6,
    "connections": [],
    "dimensions_mm": [
      55.0,
      95.0,
      4.0
    ],
    "domain": "plate",
    "explicit_dimensions": true,
    "fabrication_domain": "plate",
    "flags": {
      "fins": false,
      "holes": false,
      "hollow": false,
      "rounded": false,
      "shaft": false,
      "slots": false,
      "wheels": false,
      "wings": false
    },
    "hole_count_requested": 0,
    "hole_diameter_explicit": false,
    "hole_diameter_mm": null,
    "normalized_prompt": "a plate 55 mm wide 95 mm deep and 4 mm thick",
    "prompt": "a plate 55 mm wide 95 mm deep and 4 mm thick",
    "recognized": true,
    "slot_count_requested": 0,
    "slot_dimensions_explicit": false,
    "source": "natural_language_design_graph",
    "units": "mm",
    "wall_thickness_explicit": false,
    "wall_thickness_mm": null
  },
  "nodes": [
    {
      "id": "body",
      "primitive": {
        "kind": "box",
        "parameters": {
          "size": [
            55.0,
            95.0,
            4.0
          ]
        }
      },
      "role": "body",
      "transform": {
        "rotate": [
          0.0,
          0.0,
          0.0
        ],
        "scale": [
          1.0,
          1.0,
          1.0
        ],
        "translate": [
          0.0,
          0.0,
          0.0
        ]
      }
    }
  ],
  "roots": [
    "body"
  ],
  "title": "a plate 55 mm wide 95 mm deep and 4 mm thick",
  "units": "mm",
  "version": "neurocad-ir-v1"
}
